{
  "$schema": "../icon.schema.json",
  "contributors": [
    "karsa-mistmere",
    "danielbayley"
  ],
  "tags": [
    "statistics",
    "analytics",
    "diagram",
    "graph",
    "presentation",
    "trending up"
  ],
  "categories": [
    "cryptpad-apps",
    "files"
  ],
  "aliases": [
    {
      "name": "file-bar-chart",
      "deprecated": true,
      "deprecationReason": "alias.name",
      "toBeRemovedInVersion": "v1.0"
    }
  ]
}
